{
  "$schema": "https://json-schema.org/draft/2020-12/schema",
  "$id": "https://thebrokenbrain.github.io/drupilot/schemas/fixpoint.schema.json",
  "title": "drupilot fixpoint record (fixpoint.json)",
  "description": "The fixpoint gate's result (scripts/analysis/fixpoint.sh, AR-16, DET-8), in the subject's hidden state dir: after the extraction ran again, what Rector, the codemods and the processed lanes still have to do. converged is true only when the three lists are empty and every tool gave a verdict.",
  "type": "object",
  "required": ["schema", "tool", "mode", "stage", "converged", "rector", "codemods", "open_items"],
  "properties": {
    "schema": {"const": 1},
    "tool": {"const": "fixpoint"},
    "mode": {"description": "DRUPILOT_FIXPOINT when it ran.", "enum": ["enforce", "warn"]},
    "stage": {"type": "string", "minLength": 1},
    "processed_lanes": {"type": "array", "items": {"type": "string"}},
    "no_verdict": {"description": "True when Rector, PHPStan or a scan feeding the codemod lane (port-safety, signatures, metadata) gave no verdict: the gate cannot converge.", "type": "boolean"},
    "no_verdict_tools": {"description": "The tools that gave no verdict (findings.json .tools), or extraction when extract.sh itself gave none. Absent before 1.0.0-rc.1.", "type": "array", "items": {"type": "string"}},
    "accepted_reverts": {"description": "The deliberate reverts the decision log records (log-decision.sh --kind rector-revert): the Rector findings, codemods and open items they cover, which never block. Absent before 1.0.0-rc.1.", "type": "object", "required": ["rector", "codemods", "open_items"], "properties": {"rector": {"type": "array", "items": {"type": "object"}}, "codemods": {"type": "array", "items": {"type": "object"}}, "open_items": {"type": "array", "items": {"type": "object"}}}},
    "converged": {"type": "boolean"},
    "rector": {
      "description": "The Rector findings still there (the official dry-run: the digests rules never count).",
      "type": "array",
      "items": {"type": "object", "required": ["id", "rule", "file"], "properties": {"id": {"type": "string"}, "rule": {"type": "string"}, "file": {"type": "string"}, "anchor": {"type": ["string", "null"]}}}
    },
    "codemods": {
      "description": "The codemods that would still change a file (apply-recipes.sh --dry-run: would-apply).",
      "type": "array",
      "items": {"type": "object", "properties": {"item_id": {"type": ["string", "null"]}, "recipe": {"type": "string"}, "file": {"type": ["string", "null"]}}}
    },
    "open_items": {
      "description": "The open worklist items of a processed lane.",
      "type": "array",
      "items": {"type": "object", "required": ["id", "lane"], "properties": {"id": {"type": "string"}, "lane": {"type": "string"}, "file": {"type": "string"}, "anchor": {"type": ["string", "null"]}}}
    },
    "findings_hash": {"type": ["string", "null"]},
    "worklist_hash": {"type": ["string", "null"]},
    "meta": {"type": "object"}
  }
}
